{
  "$schema": "https://json-schema.org/draft/2020-12/schema",
  "$id": "https://solar.local/schemas/evidence/research_memory_update.v1.schema.json",
  "title": "Solar Evidence ABI - Research Memory Update",
  "type": "object",
  "required": ["schema", "task_id", "sprint_id", "node_id", "status", "inputs", "outputs", "artifacts", "provenance", "limitations"],
  "additionalProperties": false,
  "properties": {
    "schema": {"const": "research_memory_update.v1"},
    "task_id": {"type": "string", "minLength": 1},
    "sprint_id": {"type": "string", "minLength": 1},
    "node_id": {"type": "string", "minLength": 1},
    "status": {"$ref": "#/$defs/status"},
    "inputs": {"type": "object", "additionalProperties": true},
    "outputs": {
      "type": "object",
      "required": ["changes"],
      "additionalProperties": true,
      "properties": {
        "changes": {"type": "array", "items": {"$ref": "#/$defs/change"}}
      }
    },
    "artifacts": {"type": "array", "items": {"$ref": "#/$defs/artifact"}},
    "provenance": {"$ref": "#/$defs/provenance"},
    "limitations": {"type": "array", "items": {"type": "string"}}
  },
  "$defs": {
    "status": {"type": "string", "enum": ["completed", "failed", "inconclusive"]},
    "artifact": {
      "type": "object",
      "required": ["type", "path"],
      "additionalProperties": false,
      "properties": {
        "type": {"type": "string", "minLength": 1},
        "path": {"type": "string", "minLength": 1},
        "sha256": {"type": "string", "pattern": "^[A-Fa-f0-9]{64}$"}
      }
    },
    "provenance": {
      "type": "object",
      "required": ["operator_id", "implementation_package", "timestamp"],
      "additionalProperties": true,
      "properties": {
        "operator_id": {"type": "string", "minLength": 1},
        "implementation_package": {"type": "string", "minLength": 1},
        "timestamp": {"type": "string", "format": "date-time"}
      }
    },
    "change": {
      "type": "object",
      "required": ["entity_type", "entity_id", "operation", "path", "evidence_ids"],
      "additionalProperties": true,
      "properties": {
        "entity_type": {"type": "string", "minLength": 1},
        "entity_id": {"type": "string", "minLength": 1},
        "operation": {"type": "string", "enum": ["create", "update", "delete", "propose", "no_op"]},
        "path": {"type": "string", "minLength": 1},
        "evidence_ids": {"type": "array", "items": {"type": "string", "minLength": 1}},
        "confidence": {"type": "number", "minimum": 0, "maximum": 1}
      }
    }
  }
}
