{
  "artifacts": [
    {
      "path": "artifacts/autosci/runs/shim-edit-policy-auto/edit_wiki_plan_gate_policy_decision.json",
      "type": "gate_policy_decision_json"
    },
    {
      "path": "artifacts/autosci/runs/shim-edit-policy-auto/edit_wiki_plan_gate_policy_allowlist.json",
      "type": "gate_policy_allowlist_json"
    },
    {
      "path": "artifacts/autosci/runs/shim-edit-policy-auto/edit_wiki_plan_local_mutation_runtime_evidence.json",
      "type": "edit_wiki_plan_local_mutation_runtime_evidence_json"
    },
    {
      "path": "artifacts/autosci/runs/shim-edit-policy-auto/edit_wiki_plan_approval_contract.json",
      "type": "approval_contract_json"
    },
    {
      "path": "artifacts/autosci/workspace/wiki/ideas/skillgen.md",
      "type": "wiki_page"
    },
    {
      "path": "artifacts/autosci/workspace/wiki/log.md",
      "type": "wiki_log"
    },
    {
      "path": "artifacts/autosci/workspace/wiki/index.md",
      "type": "wiki_rebuild"
    },
    {
      "path": "artifacts/autosci/workspace/wiki/graph/context_brief.md",
      "type": "wiki_rebuild"
    },
    {
      "path": "artifacts/autosci/runs/shim-edit-policy-auto/edit_wiki_plan_source_provider_runtime_proof.json",
      "type": "provider_source_runtime_proof_manifest_json"
    },
    {
      "path": "artifacts/autosci/runs/shim-edit-policy-auto/edit_wiki_plan_approval_runtime_proof.json",
      "type": "approval_runtime_proof_manifest_json"
    },
    {
      "path": "artifacts/autosci/runs/shim-edit-policy-auto/edit_wiki_plan_side_effect_execution_runtime_proof.json",
      "type": "side_effect_runtime_proof_manifest_json"
    },
    {
      "path": "artifacts/autosci/runs/shim-edit-policy-auto/edit_wiki_plan_wiki_mutation_runtime_proof.json",
      "type": "wiki_mutation_runtime_proof_manifest_json"
    },
    {
      "path": "artifacts/autosci/runs/shim-edit-policy-auto/research_memory_update.edit_plan.json",
      "type": "solar_evidence_json"
    }
  ],
  "inputs": {
    "after_artifacts": [
      "/Users/jamesyuan/Developer/Github Repos (On Git)/BetterSolar/docs/testing/test-runs/20260710-0121-qa-full-audit/tmp/system-tmp/pytest-of-jamesyuan/pytest-1/test_autosci_skill_shim_edit_p0/skillgen-after.md"
    ],
    "approval_ref": "policy:auto:parity_demo:edit_wiki_plan:2026-07-10T05:55:00Z",
    "execute_approved_side_effect": true,
    "gate_mode": "parity_demo",
    "native_options": {
      "add": "",
      "affiliation_logo": "",
      "after_artifacts": [
        "/Users/jamesyuan/Developer/Github Repos (On Git)/BetterSolar/docs/testing/test-runs/20260710-0121-qa-full-audit/tmp/system-tmp/pytest-of-jamesyuan/pytest-1/test_autosci_skill_shim_edit_p0/skillgen-after.md"
      ],
      "all": false,
      "allowlist_evidence": [],
      "anonymous": false,
      "approval_ref": "",
      "authors": "",
      "auto": false,
      "auto_figures": false,
      "before_artifacts": [],
      "canvas": false,
      "checklist": false,
      "claims_evidence": [],
      "code_evidence": [],
      "collect": false,
      "collect_ready": false,
      "compile_after_artifacts": [],
      "compile_allowlist_evidence": [],
      "compile_approval_ref": "",
      "compile_before_artifacts": [],
      "compile_execute_approved": false,
      "compile_executor_timeout_seconds": 120,
      "compile_runtime_evidence": [],
      "compile_target": "",
      "conference_logo": "",
      "crystallize": false,
      "daily_categories": [],
      "daily_decisions": "",
      "daily_feed": "",
      "daily_hours": 0,
      "daily_max_auto_ingest": 0,
      "daily_max_recommendations": 0,
      "daily_mode": "",
      "daily_no_external": false,
      "daily_send_email": "",
      "depth": 0,
      "difficulty": "",
      "discover": false,
      "double_blind": false,
      "edge_types": "",
      "env": "",
      "execute_approved": false,
      "experiment_after_artifacts": [],
      "experiment_allowlist_evidence": [],
      "experiment_approval_ref": "",
      "experiment_before_artifacts": [],
      "experiment_execute_approved": false,
      "experiment_executor_timeout_seconds": 120,
      "experiment_result_evidence": [],
      "experiment_runtime_evidence": [],
      "fix": false,
      "focus": "",
      "format": "",
      "full": false,
      "idea_approval_ref": "",
      "layout": "",
      "lifecycle_summary": [],
      "max_ideas": 0,
      "max_rounds": 0,
      "min_font_size": null,
      "model_command": "",
      "model_evidence": [],
      "no_figures": false,
      "no_introduction": false,
      "no_logos": false,
      "no_refine": false,
      "novelty_evidence": [],
      "obsidian": false,
      "online": false,
      "page_count": null,
      "page_limit": null,
      "paper_slug": "",
      "pdf_inspection": "",
      "pilot_handoff_evidence": [],
      "pilot_runtime_evidence": [],
      "pipeline": "",
      "quick": false,
      "refine_iterations": 0,
      "remote_check_command": "",
      "remote_run_dir": "",
      "render": false,
      "require_review_llm": false,
      "results_approval_ref": "",
      "review": false,
      "review_llm_command": "",
      "review_llm_endpoint": "",
      "review_llm_evidence": [],
      "review_llm_model": "",
      "review_llm_provider": "",
      "reviewer_thread_evidence": [],
      "runtime_evidence": [],
      "scheduler_demo": false,
      "scheduler_dispatch_external_evidence": false,
      "scheduler_include_blocked_external": false,
      "scheduler_include_human_gates": false,
      "scheduler_legacy_smoke_runner": false,
      "scheduler_node_id": [],
      "scheduler_require_workflow_config_alignment": false,
      "scheduler_run": false,
      "scheduler_timeout": 30.0,
      "scope": "",
      "serve": false,
      "skip_paper": false,
      "skip_pilot": false,
      "skip_validation": false,
      "source_evidence": [],
      "start_from": "",
      "stress_test": null,
      "submission_audit": "",
      "submission_mode": "",
      "submission_profile": "",
      "target_score": 0.0,
      "title": "",
      "types": "",
      "verbose": false,
      "verified_min_font_size": null,
      "verified_page_count": null,
      "visualize": false,
      "write": false
    },
    "policy_auto_execute_side_effect": true,
    "smoke_mode": false,
    "target": "wiki/ideas/skillgen.md"
  },
  "limitations": [
    "Wiki edit mutation was applied only because approval_ref, execute_approved_side_effect, and after_artifact evidence were supplied."
  ],
  "node_id": "node-edit-wiki-plan",
  "outputs": {
    "changes": [
      {
        "after_artifact": "/Users/jamesyuan/Developer/Github Repos (On Git)/BetterSolar/docs/testing/test-runs/20260710-0121-qa-full-audit/tmp/system-tmp/pytest-of-jamesyuan/pytest-1/test_autosci_skill_shim_edit_p0/skillgen-after.md",
        "after_sha256": "fdc91f5e04be4cd7eef1afc49f8f4d640178c2921ddc44cb02d0a05bdaeabde1",
        "before_sha256": "c80355c3273eaa0a92da5528d02ee15192302eeb79082c4b8e7ce30a135fcb65",
        "changed": true,
        "confidence": 0.84,
        "entity_id": "wiki-edit-wiki-ideas-skillgen-md",
        "entity_type": "wiki_page",
        "evidence_ids": [
          "edit-plan:wiki-ideas-skillgen-md"
        ],
        "operation": "update",
        "path": "artifacts/autosci/workspace/wiki/ideas/skillgen.md",
        "summary": "Approved wiki edit applied from after_artifact evidence."
      }
    ],
    "policy_decision": {
      "action": "edit_wiki_plan",
      "allow_destructive": false,
      "allow_email": false,
      "allow_network": false,
      "allow_remote": false,
      "allowed": true,
      "allowed_write_roots": [
        "artifacts/autosci",
        "artifacts/scientific"
      ],
      "blocked": false,
      "execute_side_effects": true,
      "mode": "parity_demo",
      "proof_best_effort": false,
      "proof_required": true,
      "reasons": [
        "read_local is allowed in parity_demo.",
        "write_artifact is allowed in parity_demo.",
        "wiki_mutation is auto-allowed in parity_demo."
      ],
      "require_approval_ref": false,
      "require_before_after_artifacts": false,
      "require_hitl": false,
      "require_runtime_evidence": false,
      "sandbox_required": true,
      "side_effects": [
        "read_local",
        "write_artifact",
        "wiki_mutation"
      ],
      "synthetic_approval_ref": "policy:auto:parity_demo:edit_wiki_plan:2026-07-10T05:55:00Z",
      "warnings": [
        "Auto-approved by gate policy mode `parity_demo`; no human approval was requested."
      ]
    }
  },
  "provenance": {
    "gate_policy": {
      "action": "edit_wiki_plan",
      "allowed": true,
      "execute_side_effects": true,
      "mode": "parity_demo",
      "proof_best_effort": false,
      "proof_required": true,
      "synthetic_approval_ref": "policy:auto:parity_demo:edit_wiki_plan:2026-07-10T05:55:00Z"
    },
    "implementation_package": "plugins/autosci",
    "operator_id": "autosci-bridge",
    "timestamp": "2026-07-10T05:55:00Z"
  },
  "schema": "research_memory_update.v1",
  "sprint_id": "phase19-skillgen-operator-smoke",
  "status": "completed",
  "task_id": "task-autosci-skillgen-edit_wiki_plan"
}
