{
  "artifacts": [
    {
      "path": "artifacts/autosci/runs/shim-single-token-dollar-command/research_memory_update.json",
      "type": "solar_evidence_json"
    }
  ],
  "inputs": {
    "native_options": {
      "add": "",
      "affiliation_logo": "",
      "after_artifacts": [],
      "all": false,
      "allowlist_evidence": [],
      "anonymous": false,
      "approval_ref": "",
      "authors": "",
      "auto": false,
      "auto_figures": false,
      "before_artifacts": [],
      "canvas": false,
      "checklist": false,
      "claims_evidence": [],
      "code_evidence": [],
      "collect": false,
      "collect_ready": false,
      "compile_after_artifacts": [],
      "compile_allowlist_evidence": [],
      "compile_approval_ref": "",
      "compile_before_artifacts": [],
      "compile_execute_approved": false,
      "compile_executor_timeout_seconds": 120,
      "compile_runtime_evidence": [],
      "compile_target": "",
      "conference_logo": "",
      "crystallize": false,
      "daily_categories": [],
      "daily_decisions": "",
      "daily_feed": "",
      "daily_hours": 0,
      "daily_max_auto_ingest": 0,
      "daily_max_recommendations": 0,
      "daily_mode": "",
      "daily_no_external": false,
      "daily_send_email": "",
      "depth": 0,
      "difficulty": "",
      "discover": false,
      "double_blind": false,
      "edge_types": "",
      "env": "",
      "execute_approved": false,
      "experiment_after_artifacts": [],
      "experiment_allowlist_evidence": [],
      "experiment_approval_ref": "",
      "experiment_before_artifacts": [],
      "experiment_execute_approved": false,
      "experiment_executor_timeout_seconds": 120,
      "experiment_result_evidence": [],
      "experiment_runtime_evidence": [],
      "fix": false,
      "focus": "",
      "format": "latex",
      "full": false,
      "idea_approval_ref": "",
      "layout": "",
      "lifecycle_summary": [],
      "max_ideas": 0,
      "max_rounds": 0,
      "min_font_size": null,
      "model_command": "",
      "model_evidence": [],
      "no_figures": false,
      "no_introduction": false,
      "no_logos": false,
      "no_refine": false,
      "novelty_evidence": [],
      "obsidian": false,
      "online": false,
      "page_count": null,
      "page_limit": null,
      "paper_slug": "",
      "pdf_inspection": "",
      "pilot_handoff_evidence": [],
      "pilot_runtime_evidence": [],
      "pipeline": "",
      "quick": false,
      "refine_iterations": 0,
      "remote_check_command": "",
      "remote_run_dir": "",
      "render": false,
      "require_review_llm": false,
      "results_approval_ref": "",
      "review": false,
      "review_llm_command": "",
      "review_llm_endpoint": "",
      "review_llm_evidence": [],
      "review_llm_model": "",
      "review_llm_provider": "",
      "reviewer_thread_evidence": [],
      "runtime_evidence": [],
      "scheduler_demo": false,
      "scheduler_dispatch_external_evidence": false,
      "scheduler_include_blocked_external": false,
      "scheduler_include_human_gates": false,
      "scheduler_legacy_smoke_runner": false,
      "scheduler_node_id": [],
      "scheduler_require_workflow_config_alignment": false,
      "scheduler_run": false,
      "scheduler_timeout": 30.0,
      "scope": "",
      "serve": false,
      "skip_paper": false,
      "skip_pilot": false,
      "skip_validation": false,
      "source_evidence": [],
      "start_from": "",
      "stress_test": null,
      "submission_audit": "",
      "submission_mode": "",
      "submission_profile": "",
      "target_score": 0.0,
      "title": "",
      "types": "",
      "verbose": false,
      "verified_min_font_size": null,
      "verified_page_count": null,
      "visualize": false,
      "write": false
    },
    "paper_path": "/Users/jamesyuan/Developer/Github Repos (On Git)/BetterSolar/docs/testing/test-runs/20260710-0121-qa-full-audit/tmp/checkout/harness/plugins/autosci/tests/fixtures/skillgen_operator_smoke_paper.md",
    "smoke_mode": true
  },
  "limitations": [
    "Fixture proposes a memory update; it does not mutate wiki state."
  ],
  "node_id": "node-ingest-paper",
  "outputs": {
    "changes": [
      {
        "confidence": 0.9,
        "entity_id": "paper-skillgen-operator-smoke-paper",
        "entity_type": "paper",
        "evidence_ids": [
          "paper-skillgen-operator-smoke-paper"
        ],
        "operation": "propose",
        "path": "knowledge/research/papers/paper-skillgen-operator-smoke-paper.md",
        "summary": "Propose recording normalized metadata for SKILLGEN: Verified Inference-Time Agent Skill Synthesis."
      }
    ]
  },
  "provenance": {
    "implementation_package": "plugins/autosci",
    "operator_id": "autosci-bridge",
    "timestamp": "2026-07-10T14:02:41Z"
  },
  "schema": "research_memory_update.v1",
  "sprint_id": "phase19-skillgen-operator-smoke",
  "status": "completed",
  "task_id": "task-autosci-skillgen-ingest_paper"
}
