{
  "artifacts": [
    {
      "path": "artifacts/scientific/scheduler-lifecycle-smoke/job-scientific-lifecycle-production-boundary-test/idea_evaluate/task-job-scientific-lifecycle-production-boundary-test-idea_evaluate/research_memory_update.json",
      "type": "solar_evidence_json"
    }
  ],
  "inputs": {
    "allow_network_fetch": false,
    "claims_evidence": "artifacts/scientific/scheduler-lifecycle-smoke/job-scientific-lifecycle-production-boundary-test/claim_extract/task-job-scientific-lifecycle-production-boundary-test-claim_extract/research_claims.json",
    "ideas_evidence": "artifacts/scientific/scheduler-lifecycle-smoke/job-scientific-lifecycle-production-boundary-test/idea_generate/task-job-scientific-lifecycle-production-boundary-test-idea_generate/idea_candidate.json",
    "method_evidence": "artifacts/scientific/scheduler-lifecycle-smoke/job-scientific-lifecycle-production-boundary-test/method_extract/task-job-scientific-lifecycle-production-boundary-test-method_extract/research_method.json",
    "paper_evidence": "artifacts/scientific/scheduler-lifecycle-smoke/job-scientific-lifecycle-production-boundary-test/paper_ingest/task-job-scientific-lifecycle-production-boundary-test-paper_ingest/research_paper.json",
    "paper_id": "paper-job-scientific-lifecycle-production-boundary-test",
    "paper_path": "plugins/autosci/tests/fixtures/sample_paper.md",
    "smoke_mode": true
  },
  "limitations": [
    "Fixture proposes idea memory records; it does not mutate research memory."
  ],
  "node_id": "idea_evaluate",
  "outputs": {
    "changes": [
      {
        "confidence": 0.76,
        "entity_id": "idea-001",
        "entity_type": "idea",
        "evidence_ids": [
          "idea-001",
          "claim-001",
          "method-001",
          "task-job-scientific-lifecycle-production-boundary-test-paper_ingest",
          "task-job-scientific-lifecycle-production-boundary-test-claim_extract",
          "claim-002",
          "task-job-scientific-lifecycle-production-boundary-test-method_extract"
        ],
        "operation": "propose",
        "path": "knowledge/research/ideas/idea-001.md",
        "recommendation": "advance"
      },
      {
        "confidence": 0.8,
        "entity_id": "idea-duplicate-001",
        "entity_type": "idea",
        "evidence_ids": [
          "idea-duplicate-001",
          "claim-001",
          "method-001",
          "task-job-scientific-lifecycle-production-boundary-test-paper_ingest",
          "task-job-scientific-lifecycle-production-boundary-test-claim_extract",
          "claim-001",
          "claim-002",
          "task-job-scientific-lifecycle-production-boundary-test-method_extract",
          "method-001"
        ],
        "operation": "propose",
        "path": "knowledge/research/ideas/idea-duplicate-001.md",
        "recommendation": "reject"
      }
    ]
  },
  "provenance": {
    "implementation_package": "plugins/autosci",
    "operator_id": "autosci-bridge",
    "timestamp": "2026-07-10T14:05:30Z"
  },
  "schema": "research_memory_update.v1",
  "sprint_id": "job-scientific-lifecycle-production-boundary-test",
  "status": "completed",
  "task_id": "task-job-scientific-lifecycle-production-boundary-test-idea_evaluate"
}
